{"contract_version":"1.0.0","event_id":"event-100","monday_board_id":"board-1","monday_item_id":"item-1","status_column_id":"status","occurred_at":"2026-09-01T09:00:00Z","from_status":"Backlog","to_status":"In Progress","actor_resolution":"canonical_monday_id","actor_monday_id":"person-42","actor_id":"editor-42","mapping_version":"actor-v1"}
